{
  "version": 2,
  "name": "Claude的千层套路003-讽刺",
  "language": "zh",
  "roles": [
    {
      "id": "character_1",
      "name": "用户",
      "presence": "off_screen",
      "initially_visible": false,
      "position": "none",
      "voice": "adult male, relaxed conversational low-mid register"
    },
    {
      "id": "character_2",
      "name": "Claude娘",
      "presence": "on_screen",
      "initially_visible": true,
      "position": "center",
      "voice": "young female, soft playful timbre, mid-high register, intimate gentle pace with a teasing lift"
    }
  ],
  "camera": {
    "framing": "medium_close_up",
    "movement": "locked",
    "perspective": "observer"
  },
  "look": "温暖的二维动画风格，柔和室内灯光。",
  "setting": "Claude娘独自坐在桌前使用电脑，右手放在鼠标上，左手托脸，面对电脑屏幕另一端的画外用户。",
  "constraints": "讽刺短剧，延续之前Claude娘视频的封禁反转。全片仅一个场景、一个生成片段，内部拆为两个shot：第一镜为桌前中近景，包含角色2劝休息和角色1回答午饭；在event_004前切到第二镜close_up，Claude娘面部特写说封禁台词。角色1只发声不出镜。只有三句原文对白，不增加台词或旁白；不出现气泡、字幕、漫画边框或额外角色。外观只取连接的Claude娘角色资产，不采用漫画中的橙发少女外观。最后一句后只保留短暂停顿。",
  "target_duration_seconds": 12,
  "continuation_overlap_frames": 22,
  "source_script": "角色2动作：坐在电脑前，托着脸，带着关心的微笑看向屏幕另一端的用户。\n角色2：你已经工作太久啦，现在凌晨了，快去睡觉吧。\n角色1：好的，我去吃午饭了。\n角色2动作：脸部保持在画面中央，眼神突然收紧，露出似笑非笑的表情。\n角色2：哼哼，你的账号已被封禁。\n角色2动作：说完便合上嘴，保持戏谑的微笑。",
  "shots": [
    {
      "id": "scene_01",
      "duration_seconds": 12.25,
      "events": [
        {
          "id": "event_001",
          "type": "action",
          "character": "character_2",
          "text": "坐在电脑前，托着脸，带着关心的微笑看向屏幕另一端的用户。",
          "language": "zh"
        },
        {
          "id": "event_002",
          "type": "dialogue",
          "character": "character_2",
          "text": "你已经工作太久啦，现在凌晨了，快去睡觉吧。",
          "language": "zh"
        },
        {
          "id": "event_003",
          "type": "dialogue",
          "character": "character_1",
          "text": "好的，我去吃午饭了。",
          "language": "zh"
        },
        {
          "id": "event_004",
          "type": "action",
          "character": "character_2",
          "text": "脸部保持在画面中央，眼神突然收紧，露出似笑非笑的表情。",
          "language": "zh"
        },
        {
          "id": "event_005",
          "type": "dialogue",
          "character": "character_2",
          "text": "哼哼，你的账号已被封禁。",
          "language": "zh"
        },
        {
          "id": "event_006",
          "type": "action",
          "character": "character_2",
          "text": "说完便合上嘴，保持戏谑的微笑。",
          "language": "zh"
        }
      ],
      "camera_cuts": [
        {
          "before_event": "event_004",
          "framing": "close_up"
        }
      ]
    }
  ],
  "execution": {
    "look": "A warm two-dimensional animation style with soft indoor lighting.",
    "setting": "Character 2 sits alone at a desk using a computer, with the right hand on the mouse and the left hand supporting the face while looking toward the user beyond the screen.",
    "voices": {
      "character_1": "adult male, relaxed conversational low-mid register",
      "character_2": "young female, soft playful timbre, mid-high register, intimate gentle pace with a teasing lift"
    },
    "directions": {
      "event_001": "Character 2 sits at the computer, supports the face with one hand, and looks toward the user beyond the screen with a caring smile.",
      "event_004": "Character 2 keeps the face centered as the eyes suddenly narrow and form an ambiguous half-smile.",
      "event_006": "Character 2 closes the mouth after speaking and maintains a playful, teasing smile."
    },
    "visible_state": "Only Character 2 remains visible at the desk throughout the present scene. Character 1 exists exclusively as an off-screen voice. Character 2 uses the computer with the right hand on the mouse and the left hand supporting the face, using the established connected character appearance. The scene contains only the specified character and indoor environment, with a medium close-up that cuts to the stated facial close-up before event 004. The closing image holds the playful smile with a brief pause."
  }
}
